{
  "id": "saturn-4",
  "kind": "house",
  "planet": "saturn",
  "key": 4,
  "tldr": "Saturn in the 4th house: structure becomes personal through home, family, privacy, memory, and emotional foundations.",
  "body": "With Saturn in the 4th house, this part of you matures through home, family, privacy, memory, and emotional foundations. Saturn describes structure, limits, discipline, time, responsibility, fear, and earned authority. In practice, this brings attention to the private base of your life, including the rooms, roots, memories, and relationships that shape where you feel held.\n\nWhen this placement is supported, your inner life can feel more rooted and easier to live from. Saturn can become commitment, competence, patience, boundaries, and the ability to build something durable.\n\nWhen it is strained, old patterns can run the room before you have had time to name them. The harder pattern can show up as fear, rigidity, isolation, delay, or treating pressure as proof that care is not allowed.",
  "gift": "commitment, competence, patience, boundaries, and the ability to build something durable expressed through home, family, privacy, memory, and emotional foundations.",
  "challenge": "fear, rigidity, isolation, delay, or treating pressure as proof that care is not allowed around home, family, privacy, memory, and emotional foundations.",
  "voiceNeutral": true,
  "status": "REVIEWED"
}
