{
  "id": "pluto-9",
  "kind": "house",
  "planet": "pluto",
  "key": 9,
  "tldr": "Pluto in the 9th house.",
  "body": "Power and the urge to transform operates in the field of travel, higher learning, belief, and the big picture. This is where the native most naturally expresses Pluto.",
  "gift": "Career and effort gravitate toward meaning.",
  "challenge": "Control and obsession concentrated in meaning.",
  "note": "Composed (planet x house); refine from authored material.",
  "voiceNeutral": true,
  "status": "DRAFT"
}
