{
  "id": "venus-2",
  "kind": "house",
  "planet": "venus",
  "key": 2,
  "tldr": "Venus in the 2nd house.",
  "body": "Attraction, pleasure, and value operates in the field of money, resources, and what you value. This is where the native most naturally expresses Venus.",
  "gift": "Career and effort gravitate toward resources.",
  "challenge": "Indulgence and vanity concentrated in resources.",
  "note": "Composed (planet x house); refine from authored material.",
  "voiceNeutral": true,
  "status": "DRAFT"
}
