{
  "id": "venus-10",
  "kind": "house",
  "planet": "venus",
  "key": 10,
  "tldr": "Venus in the 10th house.",
  "body": "Attraction, pleasure, and value operates in the field of career, reputation, and public standing. This is where the native most naturally expresses Venus.",
  "gift": "Career and effort gravitate toward career.",
  "challenge": "Indulgence and vanity concentrated in career.",
  "note": "Composed (planet x house); refine from authored material.",
  "voiceNeutral": true,
  "status": "DRAFT"
}
